Nome,CPF,Telefone,e-mail,Cargo,Região Atuação,Sede,UF
Erico Gasparini Cardoso,009.903.877-39,11 96145-4085,erico.cardoso@maxsumseeds.com,Diretor Geral Brasil,Brasil,São Paulo,SP
Arlan Alves Lourenço,016.072.441-44,66 98428-2343,arlan@maxsumseeds.com,Agrônomo de Desenvolvimento de Mercado,"MT, RO, MS",Canarana,MT
João Manuel Barreto da Costa,092.061.874-06,84 99461-0250,joao.costa@maxsumseeds.com,Agrônomo de Desenvolvimento de Mercado,"TO, PA",Palmas,TO
Toniel da Costa Rezende,887.625.301-78,64 99916-0514,toniel.rezende@maxsumseeds.com,Agrônomo de Desenvolvimento de Mercado,"MG, GO, BA",Sobradinho ,DF
Luis Cláudio Prado,753.786.396-20,62 8138-6416,luis.prado@maxsumseeds.com,Agrônomo de Desenvolvimento de Mercado,Estação Pesquisa,Palmas,TO
Marcelo Marelli,,+549115995-5622,marcelo.marelli@maxsumseeds.com,Diretor Operações Grãos,Global,Buenos Aires,Argentina
Mauro Gonzales,,,mg.1973@hotmail.com,Líder Sustentabilidade e Rastreabilidade,Global,Madrid,Espanha
Rodrigo Gutierrez,114.860.168-63,11 97093-0885,rodrigo.gutierrez@maxsumseeds.com,Conselheiro,Global,São Paulo,SP